<?xml version='1.0' encoding='UTF-8'?>
<!ELEMENT Vorlesung (Titel, Semester+, Hochschule, SWS, Kapitel+, Quelle*)>
        <!ELEMENT Titel (#PCDATA)>
        <!ELEMENT Semester (#PCDATA)>
        <!ELEMENT Hochschule (#PCDATA)>
        <!ELEMENT SWS (#PCDATA)>
        <!ELEMENT Kapitel (#PCDATA)>
                <!ATTLIST Kapitel nummer CDATA #REQUIRED>
                <!ATTLIST Kapitel quelle IDREF #IMPLIED>
        <!ELEMENT Quelle (Autor+, Titel)>
                <!ATTLIST Quell quelleID ID #REQUIRED>
